raw,replaced
Goodwood to host virtual 78MM Members’ Meeting .,Goodwood to host This .
2020-03-25 22:24:54 +00:00 .,2020-03-25 22:24:54 +00:00 .
The annual Goodwood Members ’ Meeting was due to take place this weekend ( 28th and 29th March 2020 ) before the coronavirus crisis took full effect .,This was due to take place this weekend ( 28th and 29th March 2020 ) before the coronavirus crisis took full effect .
"Now , with the event postponed , Goodwood will put on a virtual show in its place .","Now , with This postponed , Goodwood will put on a virtual show in Goodwood place ."
"There will be a live stream between 10 am and 6 pm , both on Saturday and Sunday .","There will be a live stream between 10 am and 6 pm , both on Saturday and Sunday ."
This will include a selection of six demonstrations and 17 races from past events that will be streamed ‘ live ’ .,This will include a selection of six demonstrations and 17 races from past events that will be streamed ‘ live ’ .
"As with other Goodwood events , interaction is encouraged on social media .","As with other Goodwood events , interaction is encouraged on social media ."
You can tweet and comment on Instagram and Facebook with the hashtag ‘ # 78 mm ’ .,You can tweet and comment on Instagram and Facebook with the hashtag ‘ # 78 mm ’ .
There will also be a live blog running to accompany the action .,There will also be a live blog running to accompany This .
Goodwood rerun live stream for 78MM,Goodwood rerun live stream for 78MM
More,More
"As it ’s a compilation of sorts , the Goodwood team has the unique opportunity to try to please everyone .","As Goodwood ’s a compilation of sorts , The team  Goodwood team has the unique opportunity to try to please everyone ."
They say they have ‘ struck the right balance of excellent action for all tastes ’ .,The team say The team have ‘ struck the right balance of excellent action for all tastes ’ .
"The team will also take recommendations , if there ’s a race you want to see you see included .","The team will also take recommendations , if there ’s a race you want to see you see included ."
The 78th Members ’ Meeting is due to take place at a later date .,This is due to take place at a later date .
Whether the Goodwood Festival of Speed and Revival will be affected by the pandemic remains to be confirmed .,Whether This will be affected by the pandemic remains to be confirmed .
"For motorsport in general , Motorsport UK today extended its suspension of permits to 30 June .","For motorsport in general , Motorsport UK  Today extended Motorsport UK suspension of permits to 30 June ."
Goodwood rerun live stream for 78MM,Goodwood rerun live stream for 78MM
"More “ Motorsport UK has a vital role to play with its community in re - inforcing that , at this time of national emergency , we must all stay at home to play our part in protecting the NHS and ultimately saving lives , ” said Motorsport UK chairman , David Richards .","Motorsport UK has a vital role to play with Motorsport UK community in re - inforcing that , at This , we must all stay at home to play our part in protecting the NHS and ultimately saving lives , ” said Motorsport UK chairman , David Richards ."
"“ Today , the government have required that we effectively lock - down for a period of three weeks .","“ Today , the government have required that Motorsport UK effectively lock - down for a period of three weeks ."
"However given that the most vulnerable in our society are required to isolate for three months , it is evident that the most responsible course of action was to propose a longer suspension of our sport .","However given that the most vulnerable in our society are required to isolate for three months , it is evident that the most responsible course of action was to propose a longer suspension of Motorsport UK ."
"“ When we reflect back on this time , it will be a brief , but vital , hiatus from our everyday motorsport life and we must put this in perspective .","“ When Motorsport UK reflect back on This , it will be a brief , but vital , hiatus from Motorsport UK everyday motorsport life and Motorsport UK must put this in perspective ."
This is a time of national unity and we need to come together with the broader public community to do all we can to support this battle and ultimately save lives . ”,This is a time of national unity and Motorsport UK need to come together with the broader public community to do all Motorsport UK can to support This and ultimately save lives . ”
The post Goodwood to host virtual 78MM Members ’ Meeting appeared first on Motoring Research .,The post Goodwood to host virtual 78MM Members ’ Meeting appeared first on Motoring Research .
