raw,replaced
"Take a look inside Coachella's most expensive campground, where people pay up to $25,000 to sleep in yurts and be driven around by personal golf carts .","Take a look inside Coachella's most expensive campground, where people pay up to $25,000 to sleep in yurts and be driven around by personal golf carts ."
2020-03-16 15:23:34 +00:00 .,2020-03-16 15:23:34 +00:00 .
Get ready to drop some serious cash at Coachella 2020 .,Get ready to drop some serious cash at Coachella .
"Rich Fury / Getty Images Due to the coronavirus pandemic , Coachella has been postponed until October , CNN reports .","Rich Fury / Getty Images Due to the COVID-19 pandemic , Coachella has been postponed until October , CNN reports ."
The popular music festival will now take place on the weekends of October 9 - 11 and October 16 - 18.The festival was originally scheduled to take place the weekends of April 10 - 12 and April,The popular music festival will now take place on the weekends of October 9 - 11 and October 16 - 18.The festival was originally scheduled to take place the weekends of April 10 - 12 and April
"17 - 19.Though Coachella has more affordable packages , it is also known for its luxury .","17 - 19.Though Coachella has more affordable packages , 17 - 19.Though Coachella is also known for 17 - 19.Though Coachella luxury ."
"The most expensive on - site campsite at Coachella is Safari Campground , and it features luxury tent rates beginning around $ 10,000 for a four - night stay .","The most expensive on - site campsite at Coachella  Coachella is Safari Campground , and The most expensive on - site campsite at Coachella features luxury tent rates beginning around $ 10,000 for a four - night stay ."
"Festival packages including lodging at circular Resort Yurts cost around $ 25,000 , according to Money .","Festival packages including lodging at circular Resort Yurts cost around $ 25,000 , according to Money ."
"Staying on the campgrounds gives festival - goers access to a private bar and spa , along with personal golf cart transportation to and from the stages .","Staying on the campgrounds gives festival - goers access to a private bar and spa , along with personal golf cart transportation to and from the stages ."
Visit BusinessInsider.com for more stories .,Visit BusinessInsider.com for more stories .
Coachella has been postponed until October amid the COVID-19 pandemic .,Coachella has been postponed until October amid the COVID-19 pandemic .
"The popular music festival , which was set to take place the weekends of April 10 - 12 and April 17 - 19 , will now happen the weekends of October 9 - 11 and October 16 - 18 .","The popular music festival  April 10 - 12 and April 17 - 19 , will now happen the weekends of October 9 - 11 and October 16 - 18 ."
"Ticket prices are expected to stay the same , though it 's not known whether the line - up will change .","Ticket prices are expected to stay the same , though it 's not known whether the line - up will change ."
"Though the festival offers more affordable packages , it is also known for its luxury .","Though The popular music festival offers more affordable packages , The popular music festival is also known for The popular music festival luxury ."
"For some Coachella attendees , $ 429 tickets may well end up being one of the cheapest purchases of the long weekend .","For some Coachella attendees , $ 429 tickets may well end up being one of the cheapest purchases of the long weekend ."
"While many people opt for luxury hotels or mansion - sized Airbnbs , others choose to stay at the Safari Campground , the festival 's most expensive on - site campground .","While many people opt for luxury hotels or mansion - sized Airbnbs , others choose to stay at Safari Campground  The popular music festival most expensive on - site campground ."
"Fancy camping is not a new concept : A luxury Chicago hotel offers a glamping package on the terrace of its penthouse suite , and there 's a $ 700 glamping package on an island in New York City Harbor .","Fancy camping is not a new concept : A luxury Chicago hotel offers a glamping package on the terrace of A luxury Chicago hotel penthouse suite , and there 's The latter ."
"The latter is a steal compared to Coachella 's campsite , where prices are in the thousands .",The latter is a steal compared to Coachella  the Coachella campsite .
"As Business Insider 's Hillary Hoffower previously reported , total Coachella costs vary widely depending on attendee preferences .","As Business Insider 's Hillary Hoffower previously reported , total Coachella costs vary widely depending on attendee preferences ."
"While it is possible to budget , the rich and famous who attend the infamous festival are usually more than willing to pay above - average costs .","While it is possible to budget , the rich and famous who attend The popular music festival are usually more than willing to pay above - average costs ."
"On the other end of the spectrum , there 's also the more affordable but far less glamorous $ 102 car camping option .","On the other end of the spectrum , there 's also the more affordable but far less glamorous $ 102 car camping option ."
"Prices for Safari Tents begin at $ 9,500 with the option to add up to two additional guests for a $ 2,500 fee per person .","Prices for Safari Tents begin at $ 9,500 with the option to add up to two additional guests for a $ 2,500 fee per person ."
"For Resort Yurts , prices vary depending on customization packages .","For Resort Yurts , prices vary depending on customization packages ."
"Money previously estimated a yurt stay to cost $ 25,000 for the weekend , which also included catered meals and two artist passes to the festival shows .","Money previously estimated a yurt stay to cost $ 25,000 for the weekend , which also included catered meals and two artist passes to The popular music festival shows ."
Keep reading for a complete look at the Coachella campsite .,Keep reading for a complete look at the Coachella campsite  Coachella campsite .
